"PRENOM","NOM","DATES","IMAGE","BIOGRAPHIE"
"Diyana","AFSAR","(België, 1987-)","DIYANA_AFSAR.jpg","Diyana Afsar is actief in het Creahmbxl kunstatelier. Diyana Afsar tekent zeer herkenbare figuren: hun gedrongen lijf rust steevast op een paar oneindige benen. Verder geeft zij hun kleding – een bontkraag bijvoorbeeld – weer met veel oog voor detail. Haar personages kijken ons recht aan, hun ogen ver uiteen, en zij glimlachen ons stralend toe, misschien omdat zij in gezelschap zijn. Diyana Afsar werkt met acrylverf, stift of potlood en beeldt grote families af, waaronder bekende of atypische gezinnen. Daarbij legt zij een voorliefde aan de dag voor koningshuizen en de zanger Ricky Martin. Rond haar staande portretten prijken verzonnen bijschriften: de kunstenares geeft haar eigen draai aan de feiten. Diyana Afsar laat anderen ruimhartig delen in de gezelligheid die uit haar oeuvre spreekt. (Tekst: Créahmbxl, Anita Van Belle)",,,,,,,,,,,
"Yassir","AMAZINE","(België, 1975- )","Yassir_AMAZINE.jpg","Tijdens zijn jeugd heeft Amazine vaak het atelier van Luc Mondry en Nicole Babilas in La Clairière bezocht. Zijn tekeningen zijn gemaakt met een zwarte, rode, groene of blauwe balpen. Terwijl hij tekent in het atelier, zingt of neuriet hij, praat weinig of helemaal gevuld is (vaak aan weerskanten), is ere en duidelijke samenhang. Wanner Amazine zijn tekening heft afgewerkt,stopt hij ook met zingen. Vanaf dan begint de tekening een eigen leven te leiden, volgt zee en eigen weg, gevoed door Amazine."
"Inès","ANDOUCHE","(België, 1958-)","Ines_ANDOUCHE.JPG","Tijdens de eerste tien jaar van haar leven reist Inès veel rond, vooral in Kongo. In 1961 keert ze terug naar België, maar bezoekt ze ook verschillende instellingen in Zwitserland, Frankrijk en België, waar ze deelneemt aan creatieve ateliers.
Inès tekent intensief. Doelbewust en zelfzeker kiest ze een beeld uit een tijdschrift, een model dat ze zich vervolgens eigen maakt en een ander leven laat leiden. Die op het eerste gezicht eenvoudige mentale overdracht verheft wat aanvankelijk onbeduidend of banaal was, en maakt zichtbaar wat in eerste instantie onopgemerkt bleef. Haar wereld wordt ongetwijfeld deels bepaald door een aantal herinneringen aan de cultuur van haar kindertijd, die hier vertaald worden door een sterke artistieke persoonlijkheid."
"Seyni ","AWA CAMARA","(Senegal, 1939-)","Seyni_CAMARA.jpg","De Senegalese kunstenares Seyni Awa rebelleert tegen de verboden van haar voorouders. Ze laat haar excentrieke fantasie de vrije loop in haar figuren van klei, en crëeert op die manier een wereld die bevolkt wordt door zwangere vrouwen of vrouwen omringd door kinderen. Haar beelden zijn indrukwekkend groot (sommigen zelf tot 1m60) en worden gebakken in een put - de meest rudimentaire oven - voor haar huis. Daarna worden ze tentoongesteld op de markt van Bignona. In haar kleine huisje, verloren tussen de velden, is een volledige kamer gevuld met talloze creaturen, de ene nog vreemder dan de andere, gerangschikt volgens grootte, gevormd en gehard in de vlammen van die «permanente hel» die hen bedwingt en verwekt."
"Aimé","BAHATI","AIME_BAHATI.jpg","(Rwanda, 1984-, woont in België)","Aimé Bahati maakt zijn zorgvuldige en nauwkeurige schaalmodellen van gerecycled materiaal dat overal en nergens vandaan komt. Zo krijgen zijn dromen gestalte in miniatuur. Als kunstenaar met een lichamelijke beperking bedenkt hij vervoersmiddelen – helikopters, vliegtuigen en schepen – waarmee hij zich gemakkelijker zonder hulp van zijn moeder zou kunnen verplaatsen. Ook ontwerpt hij luxe villa’s met subtiele en elegante versieringen. Aimé Bahati ontvluchtte Rwanda samen met zijn moeder in 1995 en woont en werkt sindsdien in Luik.",,,,,,,,,,,
"Carol","BAILLY","(VS, 1955-)","Carol_BAILLY.jpg","Carol Bailly is Amerikaanse, maar ze emigreerde naar Zwitserland, waar ze zichzelf leerde tekenen. Ze koestert een uitgesproken voorkeur voor felle zuurstokkleuren in Chinese inkt, waterverf en kleurpotlood. De taferelen die ze schept, bevatten een overvloed aan details. Vrouwen spelen een centrale rol in haar vertelling; ze geeft hun het woord, soms met veel humor, dan weer sarcastisch en een enkele keer met een tragische ondertoon. Frida Khalo bezet als het archetype van de vrouwelijke kunstenaar, muze en alter ego een doorslaggevende plaats in haar composities."
"Umberto","BERGAMASCHI","(Milaan, 1954-)","BERGAMASCHI.jpg","Het was Michele Munno, de kunstenaar die aan de wieg stond van het Atelier, die hem vergezelde bij zijn zoektocht naar een persoonlijke stijl, door hem aan te moedigen om verschillende onderwerpen aan te durven. Geleidelijk aan heeft hij zijn vooroordeel overwonnen dat de elementen die hij schildert, realistisch moeten zijn, en heeft Umberto eindelijk, met een grotere beheersing, de eenvoudige vormen die eigen zijn aan zijn stijl verder uitgewerkt. Het was louter toevallig dat de gewoonte om zijn personages binnen een gesloten cirkel af te bakenen tijdens deze zoekfase is ontstaan, toen hij zich toelegde op de weergave van een muntstuk. Omdat hij daarbij een grote innerlijke voldoening had ervaren, heet Umberto die vorm nooit meer verlaten. Alles geeft hij weer als een zuivere beeltenis, zonder enige diepte, in een vruchtvliesuniversum waaruit de begrippen ruimte en tijd gebannen zijn. Deze wil tot abstrahering en het zich afzijdig houden van de elementen van de realiteit weerspiegelt de neiging van Umberto om te vluchten in een stil universum. Maar hoewel de cirkel geruststellend en beschermend is, is hij evenwel geen plaats die de inwedige integriteit afsluit of verdedigt."
"Ariane","BERGRICHTER","(Allemagne, 1937-Belgique, 1996)","ARIANE_BERGRICHTER.jpg",""Er bestaat een krioelende wereld van balpen en vilt, van cafés, van mensen aan tafels, van ramen aan de straatkant, van tramhaltes, van voorbijgangers en kunstenaars, van dames met kleine hondjes en dikke jassen, van obers en arbeiders. “Het is ongelooflijk hoeveel dakpannen er nodig zijn”, aldus een dakdekker in het tumult van tekeningen die eind jaren '80, begin jaren '90 ter plaatse in hartje Brussel werden gemaakt. “Het is ongelooflijk” hoeveel schetsen, bierkaartjes, stukjes plakband, uren van observeren en van samenvoegen Ariane Bergrichter verzamelde om een complex psychisch leven tot kunst te verheffen. Bij haar overlijden in 1996 getuigden de talrijke geschriften en tekeningen van haar moeilijkheid met het leven. Haar dochter begroef ze in een koffer, maar haalde ze twintig jaar later weer tevoorschijn en onthulde aldus het oeuvre dat ze vormen. De geassembleerde tekeningen van Ariane Bergrichter waren in 2018 voor het eerst te zien in het American Folk Art Museum in New York. Met SMILE. I LOVE IT! in 2022 heeft het ART ET MARGES MUSEUM haar eerste monografische tentoonstelling aangeboden.",,,,,,,,,,,
"Paul","BLOCKX","(België, 1961–2015)","Paul_BLOCKX.JPG","« Het grafische werk van Paul Blockx dompelt de toeschouwer onder in een wereld vol pijn. De kunstenaar laat ons op een dwingende en onontkoombare manier kennis maken met de hel van zijn leven, het psychische leed dat hij al jarenlang ervaart. Net als zoveel andere outsiderkunstenaars zoekt hij in de kunst een uitlaatklep, een manier om zijn pijn uit te schreeuwen en eraan te ontsnappen. Zijn oeuvre is sterk en authentiek en weerspiegelt de ziel van de kunstenaar. Het is een symbolische weergave van zijn persoonlijke verhaal. Het afbeelden van hoofden en gezichten speelt een “vormende rol voor het ontstaan van de perceptie”. Of bezoekers nu gechoqueerd, ontroerd of ontsteld zijn door de boodschap die dit zelfportret uitdraagt, niemand blijft onverschillig bij het zien van dit zelfbeschouwende werk. »"
"Anacleto","BORGHI","(Italië, 1921-2008)","Anacleto_BORGHI.jpg",
"Dominique","BOTTEMANE","(België ,1961-)","Dominique_BOTTEMANE.jpg","In de linosneden bevolkt met dierlijke en vrouwenfiguren waar hij bekend om staat, geeft Dominique Bottemanne blijk van een grote gevoeligheid. Als fervent sportliefhebber bekijkt hij zijn creaties ook door die bril. Vanuit het verlangen zoveel mogelijk te tonen, waagt hij zich soms aan complexe composities waarin elementen boven elkaar staan en zich verstrengelen. Veeleisend als hij is, combineert hij linosneden met olieverf en beeldhouwwerk, in een permanent streven naar het resultaat dat hij ziet in zijn verbeelding."
"Ignacio","CARLES-TOLRA ","(Spanje, 1928-)","CARLES_TOLRA_Ignacio.jpg","Van Spaanse afkomst installeert Carles-Tolra zich op 30 jarig leeftijd in Zurich waar hij na ontdekking van de geschrifte van Dubuffet als autodidact begint te creëren. Onder impuls van de vader van Art Brut met wie hij een belangrijke briefwisseling aanvat, tekent hij vooral ‘s nachts, na zijn werk bij het Rode Kruis. Hij creëerde met de jaren een rijk persoonlijk bestiarium, waarin vogels, en andere complexe eigenaardige dieren die hij “bestioles” noemt. Ignacio Carles-Tolra werkt in series als gedreven door een onweerstaanbare impuls. “Het is de woede die mij motiveert, maar ik amuseer mij zeer veel.” Vertelt hij. “Ik teken om te genezen van de dagelijkse sleur.”"
"Georges","CAUCHY","(Frankrijk, 1963-)","Georges_CAUCHY","Georges Cauchy is niet bepaald een meegaand karakter ; men zou hem gerust koppig en eigenzinnig kunnen noemen. Het is niet makkelijk om met hem te communiceren, maar zijn creative uitspattingen zijn werkelijk buitengewoon. Op die momenten buigen alle vormen zich naar zijn wil, waardoor ze heel geladen worden. Met stift creëert hij kleurvlakken vol licht en helderheid. Zijn werk is broos, want door het gebruik van de stiften vervagen de kleuren als ze worden blootgesteld aan zonlicht."
"Klaus","COMPAGNIE","(België, 1972-)","Klaus_COMPAGNIE.jpg","Klaus Compagnie was altijd al een praatvaar met een eigen commentaar op de dingen. Hij maakt anekdotische schilderijen, die deze commentaar perfect in beeld brengen. Klaus werkt enthousiast, nu en dan zelfs obsessioneel, aan de vertolking van zijn wereld.  Zijn schilderijen geven blijk van zijn kennis en zijn onbegrensde fantasie. Met verf, houtskool of met een pyrogravure schetst hij rudimentaire figuren, die hij begeleidt met uitgesproken commentaren. Hij portretteert, schildert historische feiten of onderwijst met zijn anatomische kennis. Hij brengt verslag uit over het weer of de actualiteit met een persoonlijke invulling in het Nederlands, maar ook in het Spaans en Italiaans. Zijn werk is doorspekt van een fikse dosis humor, en hij gaat recht door zee. "
"Phillippe","CONDYLIS","(Frankrijk, 1959-)","Phillippe_CONDYLIS.jpg",
"Martine","COPENAUT","(België, 1955-2004)","Martine_COPENAUT.jpg","Martine Copenaut ontdekte tegelijk de teken- en weefkunst. Wellicht is het daarom dat haar kleurige grafische composities, vol opeengepakte motieven, veel weghebben van een tapijtinslag. Haar abstracte creaties plaatsen ronde geometrische vormen naast elkaar. Ze doen denken aan een bloem die ontluikt tot aan de rand van het blad: een hele resem bonte bloemen die naast elkaar bloeien tot er geen gaatje wit meer overblijft."
"Aloïse","CORBAZ ","(Zwitserland, 1886-1964)","Aloise_CORBAZ.jpg","Na een teleurstelling in de liefde trok Aloïse op vijfentwintigjarige leeftijd naar Duitsland, waar zij als gouvernante ging werken aan het hof van keizer Willem II. In 1914, bij het aanvang van de eerste wereldoorlog, keert zij terug naar Zwitserland en vertoont zij gedragsproblemen. Haar familie besluit haar te laten opnemen in het hospitaal van Céry en vervolgens, van 1918 tot haar dood, in het asiel La Rosière van Gimel. Jacqueline Porret Forel, de arts die haar begeleidt en haar werken bestudeert, toont haar creaties aan Jean Dubuffet. De geïnterneerde Aloïse creëert verrassende werken volgens een heel eigen code. In haar tekeningen duiken veel persoonlijke herinneringen op: de weelde aan het hof van Willem II, het koningskoppel en allerlei theatrale elementen. Ze beeldt deze niet werkelijkheidsgetrouw af maar hevelt deze over naar een wereld die constant in beweging en heel afwisselend is."
"Sylvain","COSIJNS","(België, 1932–2020)","Sylvain_COSIJNS.jpg","Niemand kon vermoeden dat Sylvain Cosijns zo’n mooie artistieke toekomst tegemoet ging toen hij op 56-jarige leeftijd opgenomen werd in de instelling Mariaheem, die inmiddels omgedoopt werd tot De Bolster. Zijn eerste schilderij van een potplant, in het atelier van Jan Geldhof, trekt meteen de aandacht van de pas aangeworven animator. De kunstenaar heeft moeite met het stilleven, want zijn slecht zicht verplicht hem om telkens weer van zijn doek naar de plant te lopen. Maar van meet af aan zijn z’n trekken zowel trefzeker als fragiel. Zij getuigen reeds van die ambivalentie die de wereld van Sylvain Cosijns karakteriseert. Een wereld bewoond door talrijke figuren die de ene keer ademloos uitgelijnd worden, de andere keer in het luchtledige bewegen, soms in kleur. Een wereld die ruimtelijk gestructureerd wordt door een blad papier en tot leven gebracht wordt dankzij de visuele stimuli van picturale werken die Sylvain Cosijns inspireren, zonder dat hij deze evenwel gaat nabootsen. Men kan eindeloos fantaseren over de uitdrukkingen van zijn onbeweeglijke figuren. Maar wanneer hij zich overgeeft aan z’n werk is het telkens weer datzelfde personage in vooraanzicht, zonder leeftijd, zonder gezicht, dat terugkomt, keer na keer."
"Georges ","COUNASSE ","(België, 1933-2005)","Georges_Counasse_27.jpg","De draaimolens van Georges Counasse, een gepensioneerde bakker, zijn gemonteerd op platendraaiers en roepen onvermijdelijk herinneringen aan onze kindertijd op. Met een vrolijke assemblage van onderdelen die her en der gesprokkeld werden (popjes die de molens bevolken, parels, kerstslingers, ...) herschept de kunstenaar de kermissfeer uit de jaren 1947-1950, toen hij jong was. Paardenmolen, groot rad, draaimolen, spiegelpaleis, botsautootjes bezorgen ons een heerlijk gevoel van nostalgische vreugde."
"Kazimierz","CYCON","(Polen, 1931-2004)","Kazimierz_CYCON.jpg",
"Hylde","D’HONDT","(België, 1956-)","Hylde_DHONDT.jpg",
"Philippe ","DA FONSECA","(België, 1959-)","Da_Fonseca.jpg","Philippe da Fonseca vervoegde La ""S"" Grand Atelier in 2000. Zijn beeldtaal omvat van meet af aan boten, kerken, bomen, zonnen en manen. Het is een intuïtieve woordenschat. En hoe meer hij zijn thema’s herhaalt, hoe meer hij gestimuleerd wordt door de twee opeenvolgende animatoren van het atelier, hoe abstracter zijn boten en gebouwen, zijn hemellichamen en plantengroei worden. Het strakke zwart en wit aanvaarden nu de aanwezigheid van een levendig palet met onverwachte tinten, waarvan Michiel, de animator en kleurenmenger van het atelier, het geheim kent."
"Caroline","DAHYOT","(Frankrijk, 1968-)","Caroline_DAHYOT.jpg",
"Antonio ","DALLA VALLE ","(Cles (Trente),Italië, 1939-)","Antonio_DALLA VALLE.jpg","Antonio Dalla Valle heeft zijn creaties altijd bij zich, in een zak, wanneer hij in de psychiatrische instelling rondloopt. In de zak zitten schriften met zelfklevend papier eromheen, assemblages van viltstiften, kubussen in plexiglas waarin hij kleine volgekrabbelde papiertjes bewaart. Al die voorwerpen keren zich als revolutionaire barricades tegen de helse jachtigheid van het heden. Antonio Dalla Valle heeft voor zichzelf een geheimschrift bedacht waarin het intieme en het universele verenigd worden. Hij behoort tot dezelfde familie van kunstenaars als Artaud en Wölfli, kunstenaars voor wie het woord versmelt met het leven, kunstenaars die tegen een ruige en ongastvrije wereld reageren door hun eigen afwezigheid te organiseren."
"Michel","DAVE","(België, 1941-2018)","Michel_DAVE.jpg","« Schrijven is ook tekenen ». Geïnspireerd door dit commentaar bij de woorden die hij op een blad geschreven had, begint Michel Dave aan zijn rijkelijke productie van geschreven tekeningen of getekende geschriften. Het zijn grafische lijsten gemaakt met tekens die belangrijker zijn dan hetgeen zij op zich betekenen, ook al blijft die betekenis heel belangrijk. Het gaat hier inderdaad niet om een willekeurige reeks woorden die opgetekend worden. Michel Dave zoekt ze zorgvuldig uit in een woordenboek en beperkt zich niet tot een waarheidsgetrouw overpennen daarvan, in alfabetische orde. Wanneer men de blik laat dwalen over zijn werken valt men van de ene verrassing in de andere en springt men van geluidsassociaties over op betekenisassociaties. De weg die het oog daarbij volgt wordt aangegeven door licht golvende stippellijnen. Michel Dave begon naar het atelier La Pommeraie te komen in 1990 en vond na een grafische zoektocht die ongeveer een jaar duurde zijn eigen taal. Naarmate zijn gezondheid achteruitgaat worden zijn trekken fragieler, tot ze na een intense productieperiode helemaal stilvallen in 2015."
"Heide","DE BRUYNE","(België, 1955-)","Heide_DEBRUYNE.jpg",
"Willy","DE SMEDT","(België, 1943-)","Willy_DESMEDT.jpg","Willy De Smedt woont sinds 1998 de kunstworkshop Créahmbxl bij. Het eerste gebaar: een rechthoek tekenen. Het abstracte schilderij van Willy De Smedt wordt laag per laag opgebouwd. Tijdens het proces krijgen de uitgelijnde rechthoeken, getekend in acryl, kleur. Dan worden er andere overheen gelegd op een verschuivende manier. Het materiaal stapelt zich op. De nieuwe kleuren - misschien pastel – vermengen zich met de vorige. Het ritme van de schilderijen van Willy De Smedt, hun vibratie, wordt geboren uit deze overlappingen. Als het werk klaar is, heeft het een geheel eigen diepte gekregen. Het oog gaat door deze verdubbelde portieken en dompelt zich onder in de kleur. (Text: Créahmbxl, Anita Van Belle)",,,,,,,,,,,
"Éric","DE SULAUZE","(Frankrijk, 1963-)","ERIC_DE_SULAUZE.jpg","Éric De Sulauze woonde het kunstatelier bij van Le Pré-texte, Brussel. Voor hij aan de slag gaat voert Eric de Sulauze een aantal rituelen uit. Pas wanneer alles is zoals hij het wenst gaat hij geconcentreerd aan het werk. In het dagcentrum waar hij verblijft moet men een volledige tafel alleen voor hem voorzien. Dan neemt hij zijn kleurpotloden en begint die zorgvuldig en krachtig te verpletteren om zijn tekening te maken. Dikwijls gaat hij nog eens met een ander potlood en in een andere richting over die eerste tekening om een sterk en fluweelzacht effect te bekomen. Het resultaat doet denken aan zachte zijde. Eric de Sulauze zegt meestal weinig maar luistert wel aandachtig naar de gesprekken om hem heen. Hij vindt het heel leuk om zijn potloden te slijpen en geniet van de geur van versgeslepen hout.",,,,,,,,,,,
"Sieberen","DE VRIES","(Nederland, 1969-)","SieberenDeVRIES.jpg",
"Véronique","DECLERCQ","(België, 1947-)","declercq.jpg","Het begint allemaal met een regenboog, onvermoeibaar herhaald, met een stift. Het begint allemaal met een regenboog, en een cursus droge naald gravure aangeboden door de kunstenaar Chris Delville binnen de Club Antonin Artaud (Brussel). Het gebaar van de regenboog neemt al zijn dimensie in, brengt al zijn diepte terug als het eenmaal op dit medium is aangebracht, wat het onmogelijk maakt het ongedaan te maken, alleen de golven die van binnenuit komen kunnen direct overgenomen worden. Geraakt door het werk van Véronique Declercq, stelde Chris Delville voor dat ze deze techniek wekelijks zou blijven oefenen in haar persoonlijke workshop. Een creatieve relatie die sinds 1997 is blijven bestaan, tussen de regendruppels en de zonnestralen die door de ramen van de kleine binnenplaats binnenkomen, handlangers van het uitkomen van bogen, luchten ... golven! ... Wit en grijs."
"Serge ","DELAUNAY","(België, 1956 -2021)","Serge_DELAUNAY.jpg","Serge Delaunay werkte in het atelier Campagn’art van 1978 tot 2021. Hij maakte tekeningen met dunne lijnen in viltstift of Röthring, waarin repetitieve onderwerpen (auto’s, robots, raketten,…) vergezeld werden van informatieve teksten over techniek of mechaniek, waarbij elk woord een vaandeldrager van de toekomst lijkt. Zijn odyssee door het onmetelijke luchtruim herinnert ons aan onze eigen nietigheid. Dankzij zijn creativiteit heeft Serge Delaunay zijn eigen Odyssee van de ruimte gecreëerd bij wijze van ersatz-bestaan."
"Eric","DERKENNE","(België, 1960-2014)","Eric_DERKENNE.jpg",
"Curzio","DI GIOVANNI","(Italië, 1957-)","CurzioDiGIOVANNI.jpg",
"Georges","DUESBERG","(België, 1944-1995)","GEORGES_DUESBERG.jpg","Jarenlang, heeft Georges Duesberg op een grafische wijze verslag uitgebracht over hetgeen zich wekelijks afspeelde in La Pommeraie (Quevaucamps). Hij vindt zijn modellen in tijdschriften en bewerkt deze met ongemengde kleuren, recht uit de pot, nadat hij zijn compositie met potlood getekend en voorzien heeft van de nodige kleurenindicaties. De woordenschat die hij daarvoor gebruikt is al even persoonlijk als zijn bewerkingen: « brunis clair » (helder gebruind), « mauvé foncé » (donker gepaarst)...",,,,,,,,,,,
"Paul","DUHEM","(België, 1919-1999)","Paul_DUHEM.jpg","Duhem is zeventig als hij begint te tekenen en te schilderen. Hij werkt steeds op dezelfde manier. Eerst verkleint hij het blad met een mes en dan tekent hij met een lat een kader rond zijn blad. In de linkerbovenhoek schrijft hij zijn naam, ook in een kadertje. Zo heeft hij dat lang geleden op school geleerd. Als hij met verf werkt, gebruikt hij geen palet, hij maakt de potjes leeg in sardienenblikjes. Daardoor hebben zijn schilderijen een beperkt aantal kleuren. Zijn penselen spoelt hij nooit uit. De verf mengt zich en als de potjes bijna leeg zijn, krijgen zijn werken een olijfbruine tint. Hoewel Duhem pas op late leeftijd begint te schilderen, laat hij een groot oeuvre na. De eindeloze herhaling van steeds dezelfde thema's geeft aan dit werk iets geheimzinnigs. Alsof er 'iets' is dat Duhem steeds opnieuw probeert te vatten, vast te leggen."
"Frédéric","ETIENNE","(België, 1965-)","FredericETIENNE.jpg",
"Yves-Jules","FLEURI","(Frankrijk, 1960-)","Yves_Jules_FLEURI.jpg",
"Cecile","FRANCEUS","(België, 1962-2008)","Cecile_FRANCEUS.jpg",
,"FRANKLIN","(Portugal)","FRANKLIN.jpg",
"Jill","GALLIENI","(Frankrijk, 1948-)","Jill_GALLIENI.jpg","Deze zinnen als rozenkransen zijn zo dicht opeengepakt dat ze onleesbaar zijn. Ze vormen een gebed. Jill Galliéni richtte ze eerst tot de heilige Rita en vervolgens tot de Maagd Maria. Zij voelde de behoefte om hiermee te beginnen ontstaan rond haar dertigste, om ze vervolgens gedurende meerdere jaren te laten varen, omdat zij zich afvroeg of haar spiritualiteit een materiële vorm kon aannemen. Ze hervatte haar gewoonte toen ze eenmaal overtuigd was van de mogelijkheid. Jill Galliéni creëert ook bijzondere textielpoppen die zich onderscheiden van haar gebeden, omdat ze gemaakt werden met de bedoeling door een publiek gezien te worden.",,,,,,,,,,,
"Johan","GEENENS","(België, 1970-)","geenens.jpg","Johan Geenens ontplooit zijn talent in de Kunstwerkplaats De Zandberg (Harelbeke) sinds 1992Naast zijn etsen en linosneden die sinds meer dan tien jaar gekend zijn, toont Johan Geenens zich ook aan het publiek via tekeningen en schilderijen die een ander aspect van zijn œuvre aan het licht brengen. Zijn ogenschijnlijk abstracte composities bevatten talrijke vorm- en kleurencombinaties die een specifiek onderzoek vereisen. De tekeningenreeks « Nog een kasteel » bestaat bijvoorbeeld uit een wirwar van lijnen die wanneer men ze aandachtig onderzoekt overgaan in kleine, duidelijk afgelijnde ruimtes, in gevlochten plaatsen die een rol spelen in die subtiele mozaïek van kleuren en vormen en soms afgewisseld worden met grotere ruimten waarin de trekken vrijer en minder systematisch zijn. Dat contrast van stijlen en densiteit nodigt de toeschouwer uit om rekening te houden met elk afzonderlijk element van dat geheel, en de specifieke eigenheid daarvan te beschouwen."
"Irène","GERARD","(België, 1958-)","Irene_GERARD.jpg",
"Madge","GILL","(Engeland, 1882-1961)","Madge_GILL.jpg",
"Juanma ","GONZALEZ","(Spain, 1945 – België, 2007)","Juanma_GONZALEZ.jpg","Juanma was taxichauffeur en werd schoenmaker. “Een schoen open maken verschaft me veel plezier, de structuur ervan ontdekken, de materialen herkennen, van de geraffineerdste tot de meest ordinaire, handwerk of machinewerk.  Het doet me een beetje denken aan het openmaken van een motor, maar dan minder vuil.» Door een tv-uitzending krijgt hij zin om te schilderen. Hij schildert een landschapje dat onder de voeten wordt gelopen. Het werk van Juanma wordt niet vergeten, maar verdwijnt vanzelf."
"Daniel","GONÇALVES","(Portugal, 1977-)","DANIEL_GONCALVES.jpg","De betoverende composities van Daniel Gonçalves ademen mysterie. Alsof de kunstenaar een magische taal beheerst waarmee hij de verborgen mechanismen van de wereld zichtbaar maakt. Deze kunstwerken komen ‘s nachts tot stand, volgens een precies en onveranderlijk ritueel. Daniel Gonçalves werkt altijd met een balpen en een passer, op dezelfde stoel en met zijn blik op het oosten. Hij werkt direct, zonder voorafgaande schetsen, in een staat van opperste meditatieve concentratie. Zo, in trance bijna, voelt hij zich één met de psychische krachten van het universum. Geleidelijk worden zijn cirkelcomposities steeds geometrischer van opzet. De kunstenaar streeft perfectie na: “Ik wil zuiverheid, nauwkeurigheid, volmaaktheid, evenwicht tot uitdrukking brengen en deze energie overdragen op de kijker. Daarbij ga ik uit van elementen die we allemaal kennen.” (interview verschenen in RAW VISION nr. 101).",,,,,,,,,,,
